<?xml version='1.0' encoding='ISO-8859-1'?>
<!DOCTYPE root SYSTEM "TreeMap.dtd" >
	<root>
		<label>Node 0</label>
		<branch>
			<label>Node 1</label>
			<leaf>
				<label>leaf 2</label>
				<weight>40.0</weight>
				<value>40.0</value>
			</leaf>
			<leaf>
				<label>leaf 3</label>
				<weight>19.0</weight>
				<value>19.0</value>
			</leaf>
		</branch>
		<branch>
			<label>Node 4</label>
			<leaf>
				<label>leaf 5</label>
				<weight>2.0</weight>
				<value>2.0</value>
			</leaf>
		</branch>
		<branch>
			<label>Node 6</label>
			<leaf>
				<label>leaf 7</label>
				<weight>1.0</weight>
				<value>1.0</value>
			</leaf>
		</branch>
		<branch>
			<label>Node 8</label>
			<leaf>
				<label>leaf 9</label>
				<weight>7.0</weight>
				<value>7.0</value>
			</leaf>
			<leaf>
				<label>leaf 10</label>
				<weight>6.0</weight>
				<value>6.0</value>
			</leaf>
			<leaf>
				<label>leaf 11</label>
				<weight>3.0</weight>
				<value>3.0</value>
			</leaf>
			<leaf>
				<label>leaf 12</label>
				<weight>5.0</weight>
				<value>6.0</value>
			</leaf>
			<leaf>
				<label>leaf 13</label>
				<weight>3.0</weight>
				<value>3.0</value>
			</leaf>
			<leaf>
				<label>leaf 14</label>
				<weight>3.0</weight>
				<value>3.0</value>
			</leaf>
			<leaf>
				<label>leaf 15</label>
				<weight>3.0</weight>
				<value>3.0</value>
			</leaf>
			<leaf>
				<label>leaf 16</label>
				<weight>3.0</weight>
				<value>3.0</value>
			</leaf>
			<leaf>
				<label>leaf 17</label>
				<weight>5.0</weight>
				<value>5.0</value>
			</leaf>
			<leaf>
				<label>leaf 18</label>
				<weight>3.0</weight>
				<value>3.0</value>
			</leaf>
			<leaf>
				<label>leaf 19</label>
				<weight>3.0</weight>
				<value>3.0</value>
			</leaf>
			<leaf>
				<label>leaf 20</label>
				<weight>1.0</weight>
				<value>1.0</value>
			</leaf>
			<leaf>
				<label>leaf 21</label>
				<weight>3.0</weight>
				<value>3.0</value>
			</leaf>
			<leaf>
				<label>leaf 22</label>
				<weight>4.0</weight>
				<value>5.0</value>
			</leaf>
		</branch>
		<branch>
			<label>Node 23</label>
			<leaf>
				<label>leaf 24</label>
				<weight>3.0</weight>
				<value>3.0</value>
			</leaf>
		</branch>
		<leaf>
			<label>leaf 25</label>
			<weight>0.0</weight>
			<value>0.0</value>
		</leaf>
		<branch>
			<label>Node 26</label>
			<leaf>
				<label>leaf 27</label>
				<weight>2.0</weight>
				<value>2.0</value>
			</leaf>
		</branch>
		<branch>
			<label>Node 28</label>
			<leaf>
				<label>leaf 29</label>
				<weight>1.0</weight>
				<value>1.0</value>
			</leaf>
			<leaf>
				<label>leaf 30</label>
				<weight>5.0</weight>
				<value>5.0</value>
			</leaf>
			<leaf>
				<label>leaf 31</label>
				<weight>1.0</weight>
				<value>1.0</value>
			</leaf>
			<leaf>
				<label>leaf 32</label>
				<weight>4.0</weight>
				<value>4.0</value>
			</leaf>
			<leaf>
				<label>leaf 33</label>
				<weight>1.0</weight>
				<value>1.0</value>
			</leaf>
		</branch>
		<leaf>
			<label>leaf 34</label>
			<weight>0.0</weight>
			<value>0.0</value>
		</leaf>
		<branch>
			<label>Node 35</label>
			<leaf>
				<label>leaf 36</label>
				<weight>2.0</weight>
				<value>2.0</value>
			</leaf>
		</branch>
		<branch>
			<label>Node 37</label>
			<leaf>
				<label>leaf 38</label>
				<weight>1.0</weight>
				<value>1.0</value>
			</leaf>
			<leaf>
				<label>leaf 39</label>
				<weight>1.0</weight>
				<value>1.0</value>
			</leaf>
			<leaf>
				<label>leaf 40</label>
				<weight>3.0</weight>
				<value>3.0</value>
			</leaf>
			<leaf>
				<label>leaf 41</label>
				<weight>1.0</weight>
				<value>1.0</value>
			</leaf>
			<leaf>
				<label>leaf 42</label>
				<weight>1.0</weight>
				<value>1.0</value>
			</leaf>
			<leaf>
				<label>leaf 43</label>
				<weight>1.0</weight>
				<value>1.0</value>
			</leaf>
			<leaf>
				<label>leaf 44</label>
				<weight>1.0</weight>
				<value>1.0</value>
			</leaf>
			<leaf>
				<label>leaf 45</label>
				<weight>1.0</weight>
				<value>0.0</value>
			</leaf>
			<leaf>
				<label>leaf 46</label>
				<weight>1.0</weight>
				<value>1.0</value>
			</leaf>
			<leaf>
				<label>leaf 47</label>
				<weight>1.0</weight>
				<value>1.0</value>
			</leaf>
			<leaf>
				<label>leaf 48</label>
				<weight>1.0</weight>
				<value>1.0</value>
			</leaf>
			<leaf>
				<label>leaf 49</label>
				<weight>1.0</weight>
				<value>1.0</value>
			</leaf>
			<leaf>
				<label>leaf 50</label>
				<weight>1.0</weight>
				<value>1.0</value>
			</leaf>
			<leaf>
				<label>leaf 51</label>
				<weight>1.0</weight>
				<value>1.0</value>
			</leaf>
			<leaf>
				<label>leaf 52</label>
				<weight>1.0</weight>
				<value>1.0</value>
			</leaf>
			<leaf>
				<label>leaf 53</label>
				<weight>1.0</weight>
				<value>0.0</value>
			</leaf>
			<leaf>
				<label>leaf 54</label>
				<weight>1.0</weight>
				<value>1.0</value>
			</leaf>
			<leaf>
				<label>leaf 55</label>
				<weight>1.0</weight>
				<value>1.0</value>
			</leaf>
			<leaf>
				<label>leaf 56</label>
				<weight>1.0</weight>
				<value>1.0</value>
			</leaf>
			<leaf>
				<label>leaf 57</label>
				<weight>1.0</weight>
				<value>1.0</value>
			</leaf>
			<leaf>
				<label>leaf 58</label>
				<weight>1.0</weight>
				<value>1.0</value>
			</leaf>
		</branch>
		<leaf>
			<label>leaf 59</label>
			<weight>0.0</weight>
			<value>0.0</value>
		</leaf>
		<branch>
			<label>Node 60</label>
			<leaf>
				<label>leaf 61</label>
				<weight>1.0</weight>
				<value>1.0</value>
			</leaf>
		</branch>
		<branch>
			<label>Node 62</label>
			<leaf>
				<label>leaf 63</label>
				<weight>7.0</weight>
				<value>0.0</value>
			</leaf>
		</branch>
		<branch>
			<label>Node 64</label>
			<branch>
				<label>Node 641</label>
				<leaf>
					<label>leaf 6411</label>
					<weight>10.0</weight>
					<value>10.0</value>
				</leaf>
				<leaf>
					<label>leaf 6412</label>
					<weight>8.0</weight>
					<value>10.0</value>
				</leaf>
			</branch>	
			<leaf>
				<label>leaf 65</label>
				<weight>5.0</weight>
				<value>5.0</value>
			</leaf>
			<leaf>
				<label>leaf 66</label>
				<weight>34.0</weight>
				<value>34.0</value>
			</leaf>
			<leaf>
				<label>leaf 67</label>
				<weight>1.0</weight>
				<value>1.0</value>
			</leaf>
			<leaf>
				<label>leaf 68</label>
				<weight>1.0</weight>
				<value>1.0</value>
			</leaf>
			<leaf>
				<label>leaf 69</label>
				<weight>1.0</weight>
				<value>1.0</value>
			</leaf>
			<leaf>
				<label>leaf 70</label>
				<weight>1.0</weight>
				<value>1.0</value>
			</leaf>
			<leaf>
				<label>leaf 71</label>
				<weight>1.0</weight>
				<value>1.0</value>
			</leaf>
			<leaf>
				<label>leaf 72</label>
				<weight>33.0</weight>
				<value>33.0</value>
			</leaf>
			<leaf>
				<label>leaf 73</label>
				<weight>1.0</weight>
				<value>1.0</value>
			</leaf>
			<leaf>
				<label>leaf 74</label>
				<weight>1.0</weight>
				<value>1.0</value>
			</leaf>
		</branch>
		<branch>
			<label>Node 75</label>
			<leaf>
				<label>leaf 76</label>
				<weight>1.0</weight>
				<value>1.0</value>
			</leaf>
			<leaf>
				<label>leaf 77</label>
				<weight>1.0</weight>
				<value>1.0</value>
			</leaf>
			<leaf>
				<label>leaf 78</label>
				<weight>1.0</weight>
				<value>1.0</value>
			</leaf>
			<leaf>
				<label>leaf 79</label>
				<weight>1.0</weight>
				<value>1.0</value>
			</leaf>
			<leaf>
				<label>leaf 80</label>
				<weight>1.0</weight>
				<value>1.0</value>
			</leaf>
			<leaf>
				<label>leaf 81</label>
				<weight>1.0</weight>
				<value>1.0</value>
			</leaf>
		</branch>
		<branch>
			<label>Node 82</label>
			<leaf>
				<label>leaf 83</label>
				<weight>25.0</weight>
				<value>25.0</value>
			</leaf>
			<leaf>
				<label>leaf 84</label>
				<weight>2.0</weight>
				<value>2.0</value>
			</leaf>
			<leaf>
				<label>leaf 85</label>
				<weight>5.0</weight>
				<value>5.0</value>
			</leaf>
		</branch>
	</root>
