<?xml version='1.0' encoding='ISO-8859-1'?>
<!DOCTYPE root SYSTEM "TreeMap.dtd" >
	<root>
		<label>Node 0</label>
		<branch>
			<label>Node 1</label>
			<leaf>
				<label>Node 2</label>
				<weight>40.0</weight>
				<value>40.0</value>
			</leaf>
			<leaf>
				<label>Node 3</label>
				<weight>19.0</weight>
				<value>19.0</value>
			</leaf>
		</branch>
		<branch>
			<label>Node 4</label>
			<leaf>
				<label>Node 5</label>
				<weight>2.0</weight>
				<value>2.0</value>
			</leaf>
		</branch>
		<branch>
			<label>Node 6</label>
			<leaf>
				<label>Node 7</label>
				<weight>1.0</weight>
				<value>1.0</value>
			</leaf>
		</branch>
		<branch>
			<label>Node 8</label>
			<leaf>
				<label>Node 9</label>
				<weight>7.0</weight>
				<value>7.0</value>
			</leaf>
			<leaf>
				<label>Node 10</label>
				<weight>6.0</weight>
				<value>6.0</value>
			</leaf>
			<leaf>
				<label>Node 11</label>
				<weight>3.0</weight>
				<value>3.0</value>
			</leaf>
			<leaf>
				<label>Node 12</label>
				<weight>5.0</weight>
				<value>6.0</value>
			</leaf>
			<leaf>
				<label>Node 13</label>
				<weight>3.0</weight>
				<value>3.0</value>
			</leaf>
			<leaf>
				<label>Node 14</label>
				<weight>3.0</weight>
				<value>3.0</value>
			</leaf>
			<leaf>
				<label>Node 15</label>
				<weight>3.0</weight>
				<value>3.0</value>
			</leaf>
			<leaf>
				<label>Node 16</label>
				<weight>3.0</weight>
				<value>3.0</value>
			</leaf>
			<leaf>
				<label>Node 17</label>
				<weight>5.0</weight>
				<value>5.0</value>
			</leaf>
			<leaf>
				<label>Node 18</label>
				<weight>3.0</weight>
				<value>3.0</value>
			</leaf>
			<leaf>
				<label>Node 19</label>
				<weight>3.0</weight>
				<value>3.0</value>
			</leaf>
			<leaf>
				<label>Node 20</label>
				<weight>1.0</weight>
				<value>1.0</value>
			</leaf>
			<leaf>
				<label>Node 21</label>
				<weight>3.0</weight>
				<value>3.0</value>
			</leaf>
			<leaf>
				<label>Node 22</label>
				<weight>4.0</weight>
				<value>5.0</value>
			</leaf>
		</branch>
		<branch>
			<label>Node 23</label>
			<leaf>
				<label>Node 24</label>
				<weight>3.0</weight>
				<value>3.0</value>
			</leaf>
		</branch>
		<leaf>
			<label>Node 25</label>
			<weight>0.0</weight>
			<value>0.0</value>
		</leaf>
		<branch>
			<label>Node 26</label>
			<leaf>
				<label>Node 27</label>
				<weight>2.0</weight>
				<value>2.0</value>
			</leaf>
		</branch>
		<branch>
			<label>Node 28</label>
			<leaf>
				<label>Node 29</label>
				<weight>1.0</weight>
				<value>1.0</value>
			</leaf>
			<leaf>
				<label>Node 30</label>
				<weight>5.0</weight>
				<value>5.0</value>
			</leaf>
			<leaf>
				<label>Node 31</label>
				<weight>1.0</weight>
				<value>1.0</value>
			</leaf>
			<leaf>
				<label>Node 32</label>
				<weight>4.0</weight>
				<value>4.0</value>
			</leaf>
			<leaf>
				<label>Node 33</label>
				<weight>1.0</weight>
				<value>1.0</value>
			</leaf>
		</branch>
		<leaf>
			<label>Node 34</label>
			<weight>0.0</weight>
			<value>0.0</value>
		</leaf>
		<branch>
			<label>Node 35</label>
			<leaf>
				<label>Node 36</label>
				<weight>2.0</weight>
				<value>2.0</value>
			</leaf>
		</branch>
		<branch>
			<label>Node 37</label>
			<leaf>
				<label>Node 38</label>
				<weight>1.0</weight>
				<value>1.0</value>
			</leaf>
			<leaf>
				<label>Node 39</label>
				<weight>1.0</weight>
				<value>1.0</value>
			</leaf>
			<leaf>
				<label>Node 40</label>
				<weight>3.0</weight>
				<value>3.0</value>
			</leaf>
			<leaf>
				<label>Node 41</label>
				<weight>1.0</weight>
				<value>1.0</value>
			</leaf>
			<leaf>
				<label>Node 42</label>
				<weight>1.0</weight>
				<value>1.0</value>
			</leaf>
			<leaf>
				<label>Node 43</label>
				<weight>1.0</weight>
				<value>1.0</value>
			</leaf>
			<leaf>
				<label>Node 44</label>
				<weight>1.0</weight>
				<value>1.0</value>
			</leaf>
			<leaf>
				<label>Node 45</label>
				<weight>1.0</weight>
				<value>0.0</value>
			</leaf>
			<leaf>
				<label>Node 46</label>
				<weight>1.0</weight>
				<value>1.0</value>
			</leaf>
			<leaf>
				<label>Node 47</label>
				<weight>1.0</weight>
				<value>1.0</value>
			</leaf>
			<leaf>
				<label>Node 48</label>
				<weight>1.0</weight>
				<value>1.0</value>
			</leaf>
			<leaf>
				<label>Node 49</label>
				<weight>1.0</weight>
				<value>1.0</value>
			</leaf>
			<leaf>
				<label>Node 50</label>
				<weight>1.0</weight>
				<value>1.0</value>
			</leaf>
			<leaf>
				<label>Node 51</label>
				<weight>1.0</weight>
				<value>1.0</value>
			</leaf>
			<leaf>
				<label>Node 52</label>
				<weight>1.0</weight>
				<value>1.0</value>
			</leaf>
			<leaf>
				<label>Node 53</label>
				<weight>1.0</weight>
				<value>0.0</value>
			</leaf>
			<leaf>
				<label>Node 54</label>
				<weight>1.0</weight>
				<value>1.0</value>
			</leaf>
			<leaf>
				<label>Node 55</label>
				<weight>1.0</weight>
				<value>1.0</value>
			</leaf>
			<leaf>
				<label>Node 56</label>
				<weight>1.0</weight>
				<value>1.0</value>
			</leaf>
			<leaf>
				<label>Node 57</label>
				<weight>1.0</weight>
				<value>1.0</value>
			</leaf>
			<leaf>
				<label>Node 58</label>
				<weight>1.0</weight>
				<value>1.0</value>
			</leaf>
		</branch>
		<leaf>
			<label>Node 59</label>
			<weight>0.0</weight>
			<value>0.0</value>
		</leaf>
		<branch>
			<label>Node 60</label>
			<leaf>
				<label>Node 61</label>
				<weight>1.0</weight>
				<value>1.0</value>
			</leaf>
		</branch>
		<branch>
			<label>Node 62</label>
			<leaf>
				<label>Node 63</label>
				<weight>7.0</weight>
				<value>0.0</value>
			</leaf>
		</branch>
		<branch>
			<label>Node 64</label>
			<leaf>
				<label>Node 65</label>
				<weight>5.0</weight>
				<value>5.0</value>
			</leaf>
			<leaf>
				<label>Node 66</label>
				<weight>34.0</weight>
				<value>34.0</value>
			</leaf>
			<leaf>
				<label>Node 67</label>
				<weight>1.0</weight>
				<value>1.0</value>
			</leaf>
			<leaf>
				<label>Node 68</label>
				<weight>1.0</weight>
				<value>1.0</value>
			</leaf>
			<leaf>
				<label>Node 69</label>
				<weight>1.0</weight>
				<value>1.0</value>
			</leaf>
			<leaf>
				<label>Node 70</label>
				<weight>1.0</weight>
				<value>1.0</value>
			</leaf>
			<leaf>
				<label>Node 71</label>
				<weight>1.0</weight>
				<value>1.0</value>
			</leaf>
			<leaf>
				<label>Node 72</label>
				<weight>33.0</weight>
				<value>33.0</value>
			</leaf>
			<leaf>
				<label>Node 73</label>
				<weight>1.0</weight>
				<value>1.0</value>
			</leaf>
			<leaf>
				<label>Node 74</label>
				<weight>1.0</weight>
				<value>1.0</value>
			</leaf>
		</branch>
		<branch>
			<label>Node 75</label>
			<leaf>
				<label>Node 76</label>
				<weight>1.0</weight>
				<value>1.0</value>
			</leaf>
			<leaf>
				<label>Node 77</label>
				<weight>1.0</weight>
				<value>1.0</value>
			</leaf>
			<leaf>
				<label>Node 78</label>
				<weight>1.0</weight>
				<value>1.0</value>
			</leaf>
			<leaf>
				<label>Node 79</label>
				<weight>1.0</weight>
				<value>1.0</value>
			</leaf>
			<leaf>
				<label>Node 80</label>
				<weight>1.0</weight>
				<value>1.0</value>
			</leaf>
			<leaf>
				<label>Node 81</label>
				<weight>1.0</weight>
				<value>1.0</value>
			</leaf>
		</branch>
		<branch>
			<label>Node 82</label>
			<leaf>
				<label>Node 83</label>
				<weight>25.0</weight>
				<value>25.0</value>
			</leaf>
			<leaf>
				<label>Node 84</label>
				<weight>2.0</weight>
				<value>2.0</value>
			</leaf>
			<leaf>
				<label>Node 85</label>
				<weight>5.0</weight>
				<value>5.0</value>
			</leaf>
		</branch>
	</root>
