<?xml version='1.0' encoding='ISO-8859-1'?>
<!DOCTYPE root SYSTEM "TreeMap.dtd" >

<root>
  <label>Root</label>
  <branch>
    <label>branch1</label>
    <branch>
	<label>branch11</label>
	<leaf>
	  <label>leaf111</label>
	  <weight>1.0</weight>
	  <value>0.5</value>
	</leaf>
	<leaf>
	  <label>leaf112</label>
	  <weight>2.0</weight>
	  <value>-5.0</value>
	</leaf>
	<leaf>
	  <label>leaf113</label>
	  <weight>0.5</weight>
	  <value>2.0</value>
	</leaf>
	<leaf>
	  <label>leaf114</label>
	  <weight>3.0</weight>
	  <value>2.0</value>
	</leaf>
	<leaf>
	  <label>leaf115</label>
	  <weight>0.25</weight>
	  <value>-5.0</value>
	</leaf>
    </branch>
    <branch>
	<label>branch12</label>
	<leaf>
	  <label>leaf121</label>
	  <weight>1.0</weight>
	  <value>1.0</value>
	</leaf>
	<leaf>
	  <label>leaf122</label>
	  <weight>2.0</weight>
	  <value>5.0</value>
	</leaf>
	<leaf>
	  <label>leaf123</label>
	  <weight>0.5</weight>
	  <value>2.0</value>
	</leaf>
	<leaf>
	  <label>leaf124</label>
	  <weight>3.0</weight>
	  <value>-2.0</value>
	</leaf>
	<leaf>
	  <label>leaf125</label>
	  <weight>0.25</weight>
	  <value>5.0</value>
	</leaf>
    </branch>
    <branch>
	<label>branch13</label>
	<leaf>
	  <label>leaf131</label>
	  <weight>1.0</weight>
	  <value>1.0</value>
	</leaf>
	<leaf>
	  <label>leaf132</label>
	  <weight>2.0</weight>
	  <value>5.0</value>
	</leaf>
	<leaf>
	  <label>leaf133</label>
	  <weight>0.5</weight>
	  <value>2.0</value>
	</leaf>
	<leaf>
	  <label>leaf134</label>
	  <weight>3.0</weight>
	  <value>2.0</value>
	</leaf>
    </branch>
    <leaf>
	<label>leaf14</label>
	<weight>3.0</weight>
	<value>2.0</value>
    </leaf>
    <leaf>
	<label>leaf15</label>
	<weight>2.0</weight>
	<value>-5.0</value>
    </leaf>
  </branch>
  <branch>
    <label>branch2</label>
    <branch>
	<label>branch21</label>
	<leaf>
	  <label>leaf211</label>
	  <weight>1.0</weight>
	  <value>-1.0</value>
	</leaf>
	<leaf>
	  <label>leaf212</label>
	  <weight>2.0</weight>
	  <value>-5.0</value>
	</leaf>
	<leaf>
	  <label>leaf213</label>
	  <weight>0.5</weight>
	  <value>2.0</value>
	</leaf>
	<leaf>
	  <label>leaf214</label>
	  <weight>3.0</weight>
	  <value>2.0</value>
	</leaf>
	<leaf>
	  <label>leaf215</label>
	  <weight>0.25</weight>
	  <value>5.0</value>
	</leaf>
    </branch>
    <branch>
	<label>branch22</label>
	<leaf>
	  <label>leaf221</label>
	  <weight>1.0</weight>
	  <value>1.0</value>
	</leaf>
	<leaf>
	  <label>leaf222</label>
	  <weight>2.0</weight>
	  <value>5.0</value>
	</leaf>
	<leaf>
	  <label>leaf223</label>
	  <weight>0.5</weight>
	  <value>2.0</value>
	</leaf>
	<leaf>
	  <label>leaf224</label>
	  <weight>3.0</weight>
	  <value>2.0</value>
	</leaf>
    </branch>
  </branch>
  <branch>
    <label>branch3</label>
    <branch>
	<label>branch31</label>
	<leaf>
	  <label>leaf311</label>
	  <weight>1.0</weight>
	  <value>-1.0</value>
	</leaf>
	<leaf>
	  <label>leaf312</label>
	  <weight>2.0</weight>
	  <value>-5.0</value>
	</leaf>
	<leaf>
	  <label>leaf313</label>
	  <weight>0.5</weight>
	  <value>-2.0</value>
	</leaf>
	<leaf>
	  <label>leaf314</label>
	  <weight>3.0</weight>
	  <value>-2.0</value>
	</leaf>
	<leaf>
	  <label>leaf315</label>
	  <weight>0.25</weight>
	  <value>-5.0</value>
	</leaf>
    </branch>
    <branch>
	<label>branch32</label>
	<leaf>
	  <label>leaf321</label>
	  <weight>1.0</weight>
	  <value>-1.0</value>
	</leaf>
	<leaf>
	  <label>leaf322</label>
	  <weight>2.0</weight>
	  <value>-5.0</value>
	</leaf>
	<leaf>
	  <label>leaf323</label>
	  <weight>0.5</weight>
	  <value>2.0</value>
	</leaf>
	<leaf>
	  <label>leaf324</label>
	  <weight>3.0</weight>
	  <value>2.0</value>
	</leaf>
	<leaf>
	  <label>leaf325</label>
	  <weight>0.25</weight>
	  <value>-5.0</value>
	</leaf>
    </branch>
    <branch>
	<label>branch33</label>
	<leaf>
	  <label>leaf331</label>
	  <weight>1.0</weight>
	  <value>-1.0</value>
	</leaf>
	<leaf>
	  <label>leaf332</label>
	  <weight>2.0</weight>
	  <value>5.0</value>
	</leaf>
	<leaf>
	  <label>leaf333</label>
	  <weight>0.5</weight>
	  <value>2.0</value>
	</leaf>
	<leaf>
	  <label>leaf334</label>
	  <weight>3.0</weight>
	  <value>-2.0</value>
	</leaf>
    </branch>
    <branch>
	<label>branch34</label>
	<leaf>
	  <label>leaf341</label>
	  <weight>1.0</weight>
	  <value>-1.0</value>
	</leaf>
	<leaf>
	  <label>leaf342</label>
	  <weight>2.0</weight>
	  <value>5.0</value>
	</leaf>
	<leaf>
	  <label>leaf343</label>
	  <weight>0.5</weight>
	  <value>-2.0</value>
	</leaf>
    </branch>
  </branch>
  <branch>
    <label>branch4</label>
    <branch>
	<label>branch41</label>
	<leaf>
	  <label>leaf411</label>
	  <weight>1.0</weight>
	  <value>1.0</value>
	</leaf>
	<leaf>
	  <label>leaf412</label>
	  <weight>2.0</weight>
	  <value>5.0</value>
	</leaf>
	<leaf>
	  <label>leaf413</label>
	  <weight>0.5</weight>
	  <value>2.5</value>
	</leaf>
	<leaf>
	  <label>leaf414</label>
	  <weight>3.0</weight>
	  <value>2.0</value>
	</leaf>
	<leaf>
	  <label>leaf415</label>
	  <weight>0.25</weight>
	  <value>-5.0</value>
	</leaf>
    </branch>
    <branch>
	<label>branch42</label>
	<leaf>
	  <label>leaf421</label>
	  <weight>1.0</weight>
	  <value>1.0</value>
	</leaf>
	<leaf>
	  <label>leaf422</label>
	  <weight>2.0</weight>
	  <value>5.0</value>
	</leaf>
	<leaf>
	  <label>leaf423</label>
	  <weight>0.5</weight>
	  <value>2.0</value>
	</leaf>
	<leaf>
	  <label>leaf424</label>
	  <weight>3.0</weight>
	  <value>2.1</value>
	</leaf>
	<leaf>
	  <label>leaf425</label>
	  <weight>0.25</weight>
	  <value>-5.0</value>
	</leaf>
    </branch>
    <branch>
	<label>branch43</label>
	<leaf>
	  <label>leaf431</label>
	  <weight>1.0</weight>
	  <value>1.0</value>
	</leaf>
	<leaf>
	  <label>leaf432</label>
	  <weight>2.0</weight>
	  <value>-5.0</value>
	</leaf>
	<leaf>
	  <label>leaf433</label>
	  <weight>0.5</weight>
	  <value>2.0</value>
	</leaf>
	<leaf>
	  <label>leaf434</label>
	  <weight>3.0</weight>
	  <value>2.0</value>
	</leaf>
    </branch>
  </branch>
</root>